id,examRound,year,questionNumber,session,subject,officialLarge,officialMedium,officialSmall,normalizedTheme,subTheme,importance,studyPoint,sourceUrl,sourceReliability,blueprintVersion,questionCountMode,memo
33-069,33,2025,69,共通,臨床医学各論,専門基礎科目,臨床医学各論,神経疾患,neurology,パーキンソン病の自律神経症状と非運動症状の特徴,,パーキンソン病の自律神経症状：起立性低血圧・便秘・流涎（唾液増加）・発汗過多。下痢・発汗低下・唾液減少は誤り。起立性低血圧は転倒の原因になる,,indexed_official,2020,180,
33-070,33,2025,70,共通,臨床医学各論,専門基礎科目,臨床医学各論,神経疾患,neurology,筋萎縮性側索硬化症（ALS）の症状と通常保たれる機能,,ALS：嚥下障害（球麻痺）・構音障害・呼吸筋麻痺が主症状。膀胱直腸障害・眼球運動障害・感覚障害・褥瘡は末期まで通常みられない（保たれる）,,indexed_official,2020,180,
33-071,33,2025,71,共通,リハビリテーション医学,専門基礎科目,リハビリテーション医学,ICF,rehabilitation,ICFの構成要素（心身機能・活動・参加・環境因子）の分類,,ICFの「活動」＝個人レベルの課題遂行（利き手交換・歩行等）。「心身機能」＝呼吸機能。「参加」＝社会参加（復職等）。家屋改修は「環境因子」,,indexed_official,2020,180,
33-072,33,2025,72,共通,リハビリテーション医学,専門基礎科目,リハビリテーション医学,脊髄損傷リハビリ,rehabilitation,脊髄損傷患者の自律神経過反射の機序・発生条件・誘因・合併症,,自律神経過反射はT6以上の高位脊髄損傷でみられる（腰髄ではない）。誘因：難治性便秘・尿路感染・褥瘡等。血圧急上昇→脳内出血の合併がある（合併しないは誤り）,,indexed_official,2020,180,
33-073,33,2025,73,共通,リハビリテーション医学,専門基礎科目,リハビリテーション医学,心臓リハビリ,rehabilitation,心臓リハビリテーションの適応と禁忌（安定期・急性期の区別）,,安定した心不全は心臓リハビリの適応。不安定狭心症・急性心筋炎・急性大動脈解離は禁忌（安静が必要）。安定冠動脈疾患・心筋梗塞回復期も適応,,indexed_official,2020,180,
33-074,33,2025,74,共通,リハビリテーション医学,専門基礎科目,リハビリテーション医学,嚥下リハビリ,rehabilitation,摂食嚥下の5期モデル（先行期・準備期・口腔期・咽頭期・食道期）,,先行期＝食物を視覚・嗅覚で認識する（正しい）。準備期＝咀嚼し食塊形成。口腔期＝食塊を咽頭に送り込む。咽頭期＝嚥下反射で食道へ。食道期＝食道から胃へ,,indexed_official,2020,180,
33-075,33,2025,75,共通,リハビリテーション医学,専門基礎科目,リハビリテーション医学,術後リハビリ,rehabilitation,大腿骨頸部骨折・人工骨頭置換術後リハビリの正しい方針,,術後早期から荷重訓練を開始するのが正しい（早期離床・廃用予防）。金属インプラントあるため極超短波は禁忌。脱臼予防のため術後は股関節回旋・過屈曲を制限,,indexed_official,2020,180,
33-076,33,2025,76,共通,リハビリテーション医学,専門基礎科目,リハビリテーション医学,フレイル,rehabilitation,改訂日本版フレイル基準（J-CHS）の5項目と含まれない指標,,J-CHS基準5項目：体重減少・筋力低下・疲労感・歩行速度低下・身体活動量低下。骨密度低下・聴力低下・認知機能低下は含まれない,,indexed_official,2020,180,
33-077,33,2025,77,共通,リハビリテーション医学,専門基礎科目,リハビリテーション医学,脳性麻痺,rehabilitation,脳性麻痺の病型分類と頻度（痙直型・アテトーゼ型・失調型）,,痙直型が最多（約70%）。かつてはアテトーゼ型が多かったが核黄疸減少により痙直型が主流。アテトーゼ型は不随意運動が特徴。失調型は少ない,,indexed_official,2020,180,
33-078,33,2025,78,共通,リハビリテーション医学,専門基礎科目,リハビリテーション医学,パーキンソン病,rehabilitation,パーキンソン病のホーン・ヤール重症度分類（ステージⅠ〜Ⅴ）,,ステージⅢ＝両側性+姿勢反射障害あり+日常生活可能・介助不要。ステージⅣ以上で介助必要。ステージⅡは姿勢反射障害なし。ステージⅤは車椅子・ベッド,,indexed_official,2020,180,
33-079,33,2025,79,共通,リハビリテーション医学,専門基礎科目,リハビリテーション医学,徒手筋力検査,rehabilitation,徒手筋力テスト（MMT）の肢位と判定基準（重力・抵抗の条件）,,MMT2＝重力を除いた肢位（側臥位）で全可動域。MMT3＝重力に抗して全可動域（座位）。MMT1＝収縮のみ触知可能。MMT4以上は抵抗に打ち勝てる,,indexed_official,2020,180,
33-080,33,2025,80,共通,リハビリテーション医学,専門基礎科目,リハビリテーション医学,重心・バランス,rehabilitation,成人正常立位姿勢での重心位置（重心線上の下からの割合）,,正常立位の重心は重心線上の下から約55%の位置（第2仙椎前方付近）。女性は男性より重心が低い傾向。重心が高いほどバランスが不安定,,indexed_official,2020,180,
33-081,33,2025,81,共通,リハビリテーション医学,専門基礎科目,リハビリテーション医学,関節リウマチ,orthopedics,関節リウマチによる典型的関節変形の種類と部位,,RA典型変形：MP関節尺側偏位・スワンネック変形・ボタン穴変形。O脚→変形性膝関節症。凹足→神経疾患。翼状肩甲→前鋸筋麻痺（長胸神経障害）,,indexed_official,2020,180,
33-082,33,2025,82,共通,リハビリテーション医学,専門基礎科目,リハビリテーション医学,社会的リハビリ,rehabilitation,社会的リハビリテーションの定義と具体的内容（医学的・職業的との区別）,,社会的リハビリ＝社会生活力を高める支援（職場環境整備・社会参加促進）。個別の理学療法は医学的リハビリ。家族介護指導・栄養管理は直接の社会的リハビリではない,,indexed_official,2020,180,
33-083,33,2025,83,共通,臨床医学各論,専門基礎科目,臨床医学各論,神経・外傷,orthopedics,腕神経叢損傷の診断に用いる検査の有用性（症例問題）,,腕神経叢損傷の診断：MRI（神経根引き抜き）・CT脊髄造影・筋電図（神経損傷評価）が有用。超音波検査は深部腕神経叢の評価に不向き→有用性が最も低い,,indexed_official,2020,180,
33-084,33,2025,84,共通,臨床医学各論,専門基礎科目,臨床医学各論,神経・外傷,orthopedics,腕神経叢の障害レベルと麻痺パターンから損傷部位を推定（症例問題）,,肘屈曲+手関節背屈+手指屈曲すべて不能＝C5〜T1の全領域障害→腋窩部での腕神経叢全束の損傷。側頸部は根レベル損傷。肘部は橈骨・尺骨神経のみ障害,,indexed_official,2020,180,
33-085,33,2025,85,共通,臨床医学各論,専門基礎科目,臨床医学各論,神経・骨格変形,orthopedics,肘骨折後遺症（外反肘）と遅発性尺骨神経麻痺の診断（症例問題）,,幼少期肘骨折→外反肘変形→遅発性尺骨神経麻痺（cubital tunnel syndrome）。外反肘が特徴的身体所見。下垂手→橈骨神経。猿手→正中神経,,indexed_official,2020,180,
33-086,33,2025,86,共通,臨床医学各論,専門基礎科目,臨床医学各論,末梢神経障害,orthopedics,外反肘による遅発性尺骨神経麻痺の障害神経の同定（症例問題）,,外反肘+小指・環指のしびれ→尺骨神経障害。尺骨神経は内側上顆後方を通過→外反肘で牽引される。筋皮神経＝肘屈曲。正中神経＝母指球萎縮（猿手）,,indexed_official,2020,180,
33-087,33,2025,87,共通,臨床医学各論,専門基礎科目,臨床医学各論,変形性関節症,orthopedics,変形性膝関節症の診断に用いる検査の有用性と鑑別（症例問題）,,スパーリングテスト＝頸椎神経根症の検査→膝OAには無用（有用性最も低い）。膝蓋跳動＝関節内水腫確認。SLR＝腰椎ヘルニア除外に有用,,indexed_official,2020,180,
33-088,33,2025,88,共通,臨床医学各論,専門基礎科目,臨床医学各論,変形性関節症,orthopedics,変形性膝関節症の運動療法（適切と適切でない運動の区別）（症例問題）,,水中ウォーキング・大腿四頭筋訓練・体幹筋訓練は膝OAに有効。長距離歩行は膝への過負荷→症状悪化リスク→適切でない,,indexed_official,2020,180,
33-089,33,2025,89,共通,臨床医学各論,専門基礎科目,臨床医学各論,感染症,infectious-disease,アニサキス症の発症機序・感染源・予防方法（症例問題）,,アニサキスは線虫（細菌でない）でイカ・サバ等に寄生。-20℃・48時間冷凍で予防可能（正しい）。イカの生食でも発症。再感染もある。加熱（70℃以上）も有効,,indexed_official,2020,180,
33-090,33,2025,90,共通,臨床医学各論,専門基礎科目,臨床医学各論,感染症,infectious-disease,アニサキス症の治療・合併症・鑑別（症例問題）,,アニサキス症の治療＝胃内視鏡でアニサキスを摘出（正しい）。抗菌薬は無効（寄生虫のため）。アナフィラキシーを起こすことがある。胃潰瘍でなく胃壁への穿入が病変,,indexed_official,2020,180,
33-091,33,2025,91,共通,東洋医学概論,専門科目,東洋医学概論,五行・蔵象,tcm-fundamentals,五志と五官の対応（恐→腎→耳聾）,,五志と臓・五官の対応：恐（腎）→耳。過度の恐れは腎気を損傷し耳聾を引き起こす。脱毛は肺・腎。浮腫は脾。口甜は脾,,indexed_official,2020,180,
33-092,33,2025,92,共通,東洋医学概論,専門科目,東洋医学概論,精・気・血・水,tcm-fundamentals,血の機能（精神活動の維持・栄養濡養）,,血の機能：精神活動の維持・栄養濡養。血は脈内をめぐる（脈外は衛気）。水穀の精微+腎精から化生（宗気により構成は誤り）,,indexed_official,2020,180,
33-093,33,2025,93,共通,東洋医学概論,専門科目,東洋医学概論,精・気・血・水,tcm-fundamentals,津液の性質と循行路（三焦を通り全身をめぐる）,,津液は三焦を通路として全身をめぐる。生成は脾胃（腎精ではない）。輸布に脾・肺・腎・三焦が関与。停滞→痰湿（脹痛は血瘀の症状）,,indexed_official,2020,180,
33-094,33,2025,94,共通,東洋医学概論,専門科目,東洋医学概論,六腑の機能,tcm-fundamentals,胃の化物作用（水穀→精微＋糟粕）,,胃の機能：受納・腐熟・化物（水穀を精微と糟粕に変化させる）・和降。化物は変化・生成の作用を指す,,indexed_official,2020,180,
33-095,33,2025,95,共通,東洋医学概論,専門科目,東洋医学概論,蔵象論,tcm-fundamentals,三焦は諸気の通路（原気を各臓腑へ運ぶ）,,三焦は元気（原気）の通路として諸気を全身に運ぶ。肺は「主気・司呼吸」で気を主るが「諸気を主宰する臓腑」は三焦とされる,,indexed_official,2020,180,
33-096,33,2025,96,共通,東洋医学概論,専門科目,東洋医学概論,経絡系統,meridians-acupoints,経絡系統で臓腑に連絡しないのは経筋,,経筋は筋肉・関節を連絡するが臓腑には連絡しない。経脈・経別・絡脈は臓腑と連絡。十二皮部は臓腑に属絡。経絡系統の構成要素を整理する,,indexed_official,2020,180,
33-097,33,2025,97,共通,東洋医学概論,専門科目,東洋医学概論,六淫,tcm-fundamentals,夏に最も影響を受けやすい外邪（暑邪）の性質（炎上性）,,暑邪の性質：炎上性・開泄性・耗気傷津・夾湿しやすい。燥邪→乾燥性。風邪→開泄性・昇散性。夏の外邪は暑邪（炎上性）が特徴,,indexed_official,2020,180,
33-098,33,2025,98,共通,東洋医学概論,専門科目,東洋医学概論,病因論,tcm-fundamentals,七情で気を消耗する感情が過度の場合の症状（動悸）,,七情と気の変動：喜→気緩・怒→気上・思→気結・悲憂→気消・恐→気下・驚→気乱。気消（悲）は心・肺を損傷→動悸,,indexed_official,2020,180,
33-099,33,2025,99,共通,東洋医学臨床論,専門科目,東洋医学臨床論,弁証論治,tcm-clinical,裏実熱と裏虚熱が同時にみられる病証（心腎不交）,,心腎不交：心火亢盛（裏実熱）と腎陰虚（裏虚熱）が同時出現。肝火犯肺は実熱のみ。心肝火旺は実熱のみ。脾胃湿熱は湿熱証,,indexed_official,2020,180,
33-100,33,2025,100,共通,東洋医学臨床論,専門科目,東洋医学臨床論,弁証論治,tcm-clinical,症例：夜間頻尿・空咳・腰膝酸軟・盗汗・舌質痩・脈細→肺腎陰虚,,肺腎陰虚：腰膝酸軟（腎陰虚）＋から咳・盗汗・舌痩・脈細。心腎不交は不眠と動悸が主。肺脾気虚は気虚症状,,indexed_official,2020,180,
33-101,33,2025,101,共通,東洋医学概論,専門科目,東洋医学概論,経脈病証,meridians-acupoints,経脈病証「胸苦しさ・胸の熱感・手掌ほてり・息切れ」→手の太陰肺経,,手の太陰肺経病証：胸苦しさ・胸の熱感・掌中熱・息切れ・咳嗽。手の少陰心経病証は咽喉乾燥・目の黄ばみ・胸肋部痛,,indexed_official,2020,180,
33-102,33,2025,102,共通,東洋医学概論,専門科目,東洋医学概論,四診法,tcm-diagnosis,舌質の色の識別（紫は舌質の色・黄黒白は舌苔の色）,,舌質の色：淡白・淡紅（正常）・紅・絳・紫・青紫。黄・黒・白・灰は舌苔の色。紫のみが舌質の色として選択肢に含まれる,,indexed_official,2020,180,
33-103,33,2025,103,共通,東洋医学臨床論,専門科目,東洋医学臨床論,弁証論治,tcm-clinical,弁証の進め方（最初に表と裏を判断）,,八綱弁証の手順：まず表裏（病の部位）を判断→次に寒熱・虚実・気血の判断へ進む。表裏は弁証の第一段階,,indexed_official,2020,180,
33-104,33,2025,104,共通,東洋医学臨床論,専門科目,東洋医学臨床論,弁証論治,tcm-clinical,六経病証「往来寒熱・目眩・脈弦」→少陽病,,少陽病：往来寒熱・口苦・目眩・脈弦が特徴。陽明病は潮熱・便秘・洪脈。太陰病は腹満・下痢・脈遅,indexed_official,2020,180,
33-105,33,2025,105,共通,東洋医学臨床論,専門科目,東洋医学臨床論,弁証論治,tcm-clinical,六部定位脈診（右関上沈の部=脾の虚）と難経六十九難の補法取穴,,右関上（沈）＝脾の虚証。難経六十九難「虚者補其母」：脾(土)の母は心(火)→心/心包経の火穴を補う（経渠は肺経金穴）,,indexed_official,2020,180,
33-106,33,2025,106,共通,経絡経穴概論,専門科目,経絡経穴概論,補瀉法,acupuncture-technique,鍼施術の補法（抜鍼後に直ちに鍼孔を閉じる）,,補法：呼気時刺入・吸気時抜鍼・抜鍼後すぐ鍼孔を閉じる。瀉法：吸気時刺入・呼気時抜鍼・鍼孔を開放・押手で揺らす,,indexed_official,2020,180,
33-107,33,2025,107,共通,経絡経穴概論,専門科目,経絡経穴概論,経絡系統,meridians-acupoints,経絡系統の構成（正経十二経脈と奇経八脈以外に経別・絡脈・経筋・皮部を含む）,,経絡系統＝経脈（正経12＋奇経8＋経別12）＋絡脈（別絡15＋浮絡＋孫絡）＋経筋12＋皮部12。「経絡＝正経＋奇経のみ」は誤り,,indexed_official,2020,180,
33-108,33,2025,108,共通,経絡経穴概論,専門科目,経絡経穴概論,特定穴（郄穴）,meridians-acupoints,郄穴でない経穴の識別（陽谷は郄穴でない）,,郄穴16穴：陽谷は小腸経の経穴（郄穴は養老）。腸骨→陽維脈の郄穴。交信→陰蹻脈の郄穴。築賓→陰維脈の郄穴,,indexed_official,2020,180,
33-109,33,2025,109,共通,経絡経穴概論,専門科目,経絡経穴概論,骨度法,meridians-acupoints,下肢の骨度法で最も長い部位（膝窩〜外果尖=16寸）,,下肢骨度法：殿溝〜膝窩14寸・膝蓋骨尖〜内果尖15寸・膝窩〜外果尖16寸（最長）・脛骨内側顆下縁〜内果尖13寸,,indexed_official,2020,180,
33-110,33,2025,110,共通,経絡経穴概論,専門科目,経絡経穴概論,特定穴（募穴）,meridians-acupoints,腹部募穴の臓腑同定（臍と恥骨結合の中点の下方5分=膀胱の募穴=中極）,,臍中〜恥骨結合上縁は5寸。中点(2.5寸)の下方5分＝臍下3寸=関元付近。設問は中極（膀胱の募穴・臍下4寸）と整理する,,indexed_official,2020,180,
33-111,33,2025,111,共通,経絡経穴概論,専門科目,経絡経穴概論,顔面部経穴,meridians-acupoints,顔面部経穴の部位（禾髎：人中溝中点と同じ高さ・鼻孔外縁下方）,,禾髎（LI19）：人中溝中点と同じ高さ・鼻孔外縁の下方が正しい。巨髎（ST3）は鼻翼外縁と同高。和髎は耳前部。顴髎は頬骨弓下,,indexed_official,2020,180,
33-112,33,2025,112,共通,経絡経穴概論,専門科目,経絡経穴概論,経穴と神経,meridians-acupoints,正中神経支配皮膚領域にある経穴の識別（少商）,,正中神経支配：母指〜環指橈側半。少商（LU11）は母指橈側→正中神経支配域。少衝は小指→尺骨神経。関衝・商陽は示指→正中神経（商陽）,,indexed_official,2020,180,
33-113,33,2025,113,共通,経絡経穴概論,専門科目,経絡経穴概論,経穴と神経,meridians-acupoints,尺骨神経支配筋上にある経穴（手五里）,,尺骨神経支配筋（骨間筋・小指球筋・尺側手根屈筋等）上の経穴。手五里は上腕尺側・尺骨神経の走行近傍。合谷・偏歴・手三里は橈骨神経支配域,,indexed_official,2020,180,
33-114,33,2025,114,共通,経絡経穴概論,専門科目,経絡経穴概論,特定穴（八会穴）,meridians-acupoints,八会穴の腑会（中脘・臍上4寸）と同じ高さに並ぶ経穴（梁門）,,腑会＝中脘（臍上4寸・前正中線）。同じ高さに梁門（ST21・臍上4寸・外方2寸）が並ぶ。承満（臍上5寸）・太乙（臍上2寸）・滑肉門（臍上1寸）,,indexed_official,2020,180,
33-115,33,2025,115,共通,経絡経穴概論,専門科目,経絡経穴概論,個別経穴,meridians-acupoints,脛骨内側顆下縁と脛骨内縁の陥凹部下方3寸=足太陰経の郄穴（地機）,,陰陵泉（脾経合穴）の下方3寸＝地機（SP8・脾経郄穴）が足太陰経の郄穴。足厥陰経の郄穴は中都（内果上7寸）,,indexed_official,2020,180,
33-116,33,2025,116,共通,経絡経穴概論,専門科目,経絡経穴概論,肩部経穴,meridians-acupoints,回旋筋腱板で肩を外転させる筋（棘上筋）上にある経穴（曲垣）,,外転に働く回旋筋腱板の筋は棘上筋。曲垣（SI13）は棘上窩内側に位置。天宗は棘下窩（棘下筋）。肩貞・臑兪は肩後方,,indexed_official,2020,180,
33-117,33,2025,117,共通,経絡経穴概論,専門科目,経絡経穴概論,背部経穴,meridians-acupoints,広背筋上にある経穴（章門）,,章門（LR13）は第11肋骨端（季肋端）に位置し広背筋の前縁上にある。神堂・志室は脊柱傍の膀胱経。淵腋は腋窩中線,,indexed_official,2020,180,
33-118,33,2025,118,共通,経絡経穴概論,専門科目,経絡経穴概論,特定穴（五兪穴）,meridians-acupoints,足少陰腎経の経金穴（復溜）と同じ高さに並ぶ経穴（交信）,,復溜（KI7）：足少陰腎経の経穴（金）・内果尖上方2寸。同じ高さに交信（KI8・腎経郄穴・陰蹻脈郄穴）が並ぶ,,indexed_official,2020,180,
33-119,33,2025,119,共通,経絡経穴概論,専門科目,経絡経穴概論,頭部経穴,meridians-acupoints,耳介付け根後縁直上・髪際上方2寸の経穴（天衝）,,天衝（GB9）：耳介付け根後縁の直上・髪際上方2寸。角孫は耳介上端・髪際。浮白は耳後・乳突上方。曲鬢は耳前上方,,indexed_official,2020,180,
33-120,33,2025,120,共通,経絡経穴概論,専門科目,経絡経穴概論,特定穴（五兪穴）,meridians-acupoints,足太陰経五兪穴で「身体が重く関節が痛む」際の経穴（太白の部位）,,「体重節痛に原穴」→脾経原穴＝太白（SP3）：足内側・第1中足指節関節内側の近位陥凹部・赤白肉際。太衝は肝経原穴（選択肢3）,,indexed_official,2020,180,
33-121,33,2025,121,共通,経絡経穴概論,専門科目,経絡経穴概論,特定穴（原穴）,meridians-acupoints,原穴が足関節部にある経脈（少陽経=丘墟・厥陰経=太衝・太陰経=太白・太陽経=京骨）,,足の原穴と部位：丘墟（少陽胆経・外果前下方）・太衝（厥陰肝経・第1中足骨間）・太白（太陰脾経・中足指節関節近位）・京骨（太陽膀胱経・第5中足骨粗面遠位）,,indexed_official,2020,180,
33-122,33,2025,122,共通,経絡経穴概論,専門科目,経絡経穴概論,特定穴（八会穴）,meridians-acupoints,八会穴の部位識別（臓会=章門・第11肋骨端下縁）,,八会穴：臓会＝章門（第11肋骨端下縁）。腑会＝中脘。血会＝膈兪（第7肋間）。気会＝膻中。筋会＝陽陵泉。骨会＝大杼。髄会＝絶骨。脈会＝太淵,,indexed_official,2020,180,
33-123,33,2025,123,共通,経絡経穴概論,専門科目,経絡経穴概論,奇穴・要穴,meridians-acupoints,中風七穴に含まれる経穴の識別（曲池が含まれる）,,中風七穴：百会・曲池・肩髃・足三里・委中・三陰交・風市の7穴。梁丘・陽陵泉は含まれない。曲池は中風七穴の代表穴,,indexed_official,2020,180,
33-124,33,2025,124,共通,経絡経穴概論,専門科目,経絡経穴概論,小児の灸,acupuncture-technique,女児の小児斜差の灸の正しい組合せ（右脾兪と左胃兪）,,小児斜差の灸：男児は左から右へ・女児は右から左へ。女児：右脾兪（右上）→左胃兪（左下）の組合せ。膈兪・肝兪は男児の取穴,,indexed_official,2020,180,
33-125,33,2025,125,共通,経絡経穴概論,専門科目,経絡経穴概論,刺鍼リスク,acupuncture-technique,直刺で肺までの距離が最も短い経穴（肩井）,,肩井（GB21）は肺尖部に最も近接する経穴。深刺→気胸リスクが最大。肺兪・大杼は背部で肺まで皮膚厚が大きい。肩井が最短,,indexed_official,2020,180,
33-126,33,2025,126,共通,経絡経穴概論,専門科目,経絡経穴概論,刺鍼リスク,acupuncture-technique,臓器損傷を避けるため最も注意すべき経穴（天突）,,天突（CV22）：胸骨柄上縁の後方に大血管・気管・甲状腺が存在。深刺で縦隔損傷のリスク。刺鍼方向（胸骨後面に沿って下方）に特に注意,,indexed_official,2020,180,
33-127,33,2025,127,共通,はり理論,専門科目,はり理論,頭痛,neurology,症例：月15回以上頭痛・起床時に強い・鎮痛薬頻繁服用=薬物使用過多による頭痛,,薬物使用過多頭痛（MOH）：月10日以上の鎮痛薬使用が3ヶ月以上継続。片頭痛は拍動性・嘔気伴う。緊張型は締め付け感。群発は一側性激痛,,indexed_official,2020,180,
33-128,33,2025,128,共通,はり理論,専門科目,はり理論,脊椎疾患,neurology,症例：両上下肢しびれ・物つかみにくい・歩行ぎこちない・四肢深部反射亢進=頸椎症性脊髄症,,頸椎症性脊髄症：両側性・四肢腱反射亢進（上位運動ニューロン障害）・歩行障害。神経根症は一側性・腱反射低下・ジャクソン陽性,,indexed_official,2020,180,
33-129,33,2025,129,共通,はり理論,専門科目,はり理論,腰椎疾患,acupuncture-technique,L5神経根障害のデルマトームへの刺鍼経穴（金門）,,L5デルマトーム：下腿外側〜足背〜母趾。金門（BL63）は足外側でL5〜S1領域に相当。伏兎はL4・地機はL4〜L5内側・条口はL4前面,,indexed_official,2020,180,
33-130,33,2025,130,共通,はり理論,専門科目,はり理論,肩関節,orthopedics,徒手検査（肘伸展で肩前面痛・肘屈曲で消失）と同様の検査（スピードテスト）,,上腕二頭筋長頭腱の障害を確認する検査：スピードテスト（肘伸展・前腕回外位で抵抗）。ダウバーンサイン（外転60〜120度で痛み）。ライトテスト（胸郭出口）,,indexed_official,2020,180,
33-131,33,2025,131,共通,はり理論,専門科目,はり理論,末梢神経障害,orthopedics,坐骨神経絞扼性神経障害で陽性となる徒手検査（ペイステスト）,,ペイステスト（梨状筋症候群）：腹臥位で股関節内旋→梨状筋を伸張→坐骨神経絞扼部の症状再現。エリーテストは大腿前面痛（腸腰筋・大腿神経),,indexed_official,2020,180,
