id,examRound,year,questionNumber,session,subject,officialLarge,officialMedium,officialSmall,normalizedTheme,subTheme,importance,studyPoint,sourceUrl,sourceReliability,blueprintVersion,questionCountMode,memo
33-001,33,2025,1,共通,医療概論,専門基礎科目,医療概論,医の倫理,medical-ethics,医学研究倫理に関する国際宣言,,ヘルシンキ宣言＝医学研究倫理。ジュネーブ宣言＝医師の誓い。リスボン宣言＝患者の権利。アルマ・アタ宣言＝プライマリヘルスケア,,indexed_official,2020,180,
33-002,33,2025,2,共通,医療概論,専門基礎科目,医療概論,医療制度,health-policy,国民医療費の範囲（含まれる費用と含まれない費用）,,国民医療費に含まれない＝予防接種・健康診断・正常分娩・差額ベッド代。帝王切開（医療行為）は含まれる,,indexed_official,2020,180,
33-003,33,2025,3,共通,医療概論,専門基礎科目,医療概論,社会保障制度,social-security,公費医療の対象となる法律と制度の分類,,公費医療＝生保医療扶助・母子保健養育医療・精神保健措置入院等。労働者災害補償保険は公費医療でなく労働保険,,indexed_official,2020,180,
33-004,33,2025,4,共通,医療概論,専門基礎科目,医療概論,医の倫理,medical-ethics,パターナリズムと患者の自己決定権・インフォームドコンセント,,パターナリズム＝医療者が患者に代わって意思決定する父権的態度。自己決定権・インフォームドコンセントと対立する概念,,indexed_official,2020,180,
33-005,33,2025,5,共通,衛生学・公衆衛生学,専門基礎科目,衛生学・公衆衛生学,疾病予防,epidemiology,ハイリスクアプローチとポピュレーションアプローチの違い,,ハイリスク＝高リスク者への個別介入（禁煙指導・運動指導等）。ポピュレーション＝集団全体への施策（ウォーキング大会等）,,indexed_official,2020,180,
33-006,33,2025,6,共通,衛生学・公衆衛生学,専門基礎科目,衛生学・公衆衛生学,学校保健,school-health,学校管理下における死亡原因の統計（突然死が最多）,,学校管理下の死亡原因は突然死（心臓疾患由来）が最多。次いで頭部外傷・溺死等の順,,indexed_official,2020,180,
33-007,33,2025,7,共通,衛生学・公衆衛生学,専門基礎科目,衛生学・公衆衛生学,感染症対策,infectious-disease-control,COVID-19の感染症法上の分類変更（5類への移行）,,COVID-19は2023年5月より5類感染症に位置付け変更。それ以前は新型インフルエンザ等感染症に分類,,indexed_official,2020,180,
33-008,33,2025,8,共通,衛生学・公衆衛生学,専門基礎科目,衛生学・公衆衛生学,産業保健,epidemiology,産業衛生管理の3管理（作業管理・作業環境管理・健康管理）の区別,,作業管理＝労働者の作業方法・保護具使用の管理。作業環境管理＝換気・測定。健康管理＝健康診断。3管理は産業医が中心,,indexed_official,2020,180,
33-009,33,2025,9,共通,衛生学・公衆衛生学,専門基礎科目,衛生学・公衆衛生学,疫学・衛生統計,epidemiology,疫学指標の分母の違い（出生数・出産数・人口）,,乳児死亡率の分母は出生数。周産期死亡率の分母は出産数+出生数。妊産婦死亡率の分母は出産数,,indexed_official,2020,180,
33-010,33,2025,10,共通,衛生学・公衆衛生学,専門基礎科目,衛生学・公衆衛生学,感染予防・消毒,infectious-disease-control,手指消毒法の種類と特徴（スクラブ法・ラビング法等）,,スクラブ法＝洗浄剤+泡立て+流水による擦り洗い。ラビング法＝速乾性消毒剤の擦り込み（流水不要）,,indexed_official,2020,180,
33-011,33,2025,11,共通,関係法規,専門基礎科目,関係法規,あはき法,hari-kyu-law,免許取消処分後の免許証返納義務（5日以内）,,免許取消・業務停止処分を受けたら5日以内に免許証を厚生労働大臣に返納。名簿消除申請や再交付申請とは異なる,,indexed_official,2020,180,
33-012,33,2025,12,共通,関係法規,専門基礎科目,関係法規,あはき法,hari-kyu-law,施術所の構造設備基準（施術室・待合室・外気開放）の数値,,施術室外気開放の正しい比率は9分の1でない（誤答の核心）。施術室6.6㎡以上・待合室3.3㎡以上・消毒設備は正しい,,indexed_official,2020,180,
33-013,33,2025,13,共通,関係法規,専門基礎科目,関係法規,あはき法,hari-kyu-law,都道府県知事の業務指示に関して意見陳述できる主体,,衛生上の業務指示に関して都道府県知事に意見を述べられるのは医師の団体（あはき法24条）。はり師・きゅう師の団体ではない,,indexed_official,2020,180,
33-014,33,2025,14,共通,関係法規,専門基礎科目,関係法規,医療関係法規,medical-personnel-law,各医療関係法律が定義する事項の正しい対応,,薬機法＝管理医療機器を定義。医療法＝助産所を定義。介護保険法＝要介護認定区分。国民健保は国民健康保険法で規定,,indexed_official,2020,180,
33-015,33,2025,15,共通,解剖学,専門基礎科目,解剖学,組織学,histology,筋組織の種類と組織学的特徴（介在板・ギャップ結合・筋小胞体）,,心筋は介在板（ギャップ結合+デスモソーム）で連結し電気興奮が伝播。平滑筋に介在板はない。筋小胞体はCa²⁺を貯蔵,,indexed_official,2020,180,
33-016,33,2025,16,共通,解剖学,専門基礎科目,解剖学,骨学,musculoskeletal-system,下肢骨（大腿骨・脛骨・腓骨）の解剖学的ランドマーク,,小転子＝大腿骨頸基部内側下方。粗線は大腿骨体後面。内側顆は大腿骨遠位端内側。脛腓関節は近位・遠位の両方に存在,,indexed_official,2020,180,
33-017,33,2025,17,共通,解剖学,専門基礎科目,解剖学,骨学,musculoskeletal-system,頭蓋冠の縫合と泉門（新生児と成人の違い）,,新生児前頭骨は左右2分（正中縫合が残存）。大泉門＝前頭骨と頭頂骨の間（冠状縫合上）。ラムダ縫合＝後頭骨と頭頂骨の間,,indexed_official,2020,180,
33-018,33,2025,18,共通,解剖学,専門基礎科目,解剖学,生殖器系,reproductive-system,卵巣の固定・血管・受精部位の解剖,,卵巣提索で骨盤側壁に固定。受精は卵管膨大部（卵巣内ではない）。卵巣動脈は腹大動脈の直接分枝（内腸骨動脈ではない）,,indexed_official,2020,180,
33-019,33,2025,19,共通,解剖学,専門基礎科目,解剖学,筋学,musculoskeletal-system,頸部の筋と腕神経叢の走行（斜角筋隙）,,前中斜角筋間（斜角筋隙）を腕神経叢と鎖骨下動脈が通過。広頸筋は顔面神経支配。前斜角筋は第1肋骨に停止（鎖骨ではない）,,indexed_official,2020,180,
33-020,33,2025,20,共通,解剖学,専門基礎科目,解剖学,循環器系,circulatory-system,心臓の弁・刺激伝導系・位置関係,,洞房結節＝上大静脈開口部付近。僧帽弁＝左房室弁。肺動脈弁は大動脈弁の前方。心臓は前縦隔でなく中縦隔に位置,,indexed_official,2020,180,
33-021,33,2025,21,共通,解剖学,専門基礎科目,解剖学,内分泌系,endocrine-system,甲状腺の組織構造・位置・血管供給,,甲状腺は濾胞構造でコロイド（サイログロブリン）を貯蔵。上皮小体は後面。上甲状腺動脈は外頸動脈の枝（鎖骨下動脈ではない）,,indexed_official,2020,180,
33-022,33,2025,22,共通,解剖学,専門基礎科目,解剖学,神経系,nervous-system,大脳の線維連絡の分類（交連線維・投射線維・連合線維）,,交連線維＝左右大脳半球をつなぐ（脳梁・前交連・後交連）。内包・大脳脚は投射線維。連合線維＝同側半球内の皮質間連絡,,indexed_official,2020,180,
33-023,33,2025,23,共通,解剖学,専門基礎科目,解剖学,神経系,nervous-system,交感神経の経路・交通枝の種類・神経伝達物質,,白交通枝＝節前線維（有髄Bm線維）。灰白交通枝＝節後線維（無髄C線維）。節前細胞体は脊髄側角。節後はノルアドレナリンを分泌,,indexed_official,2020,180,
33-024,33,2025,24,共通,生理学,専門基礎科目,生理学,血液生理,cardiovascular-physiology,血漿タンパクの種類と機能（アルブミン・フィブリノゲン）,,アルブミン＝膠質浸透圧維持・栄養状態指標。フィブリノゲン＝凝固因子（凝固時フィブリンになる）。血漿タンパクは肝臓で合成,,indexed_official,2020,180,
33-025,33,2025,25,共通,生理学,専門基礎科目,生理学,循環生理,cardiovascular-physiology,肺循環における血管・血液・血圧の特徴,,肺動脈＝静脈血（右室→肺）。肺静脈＝動脈血（肺→左房）。肺血圧（収縮期約25mmHg）は体血圧（120mmHg）より低い,,indexed_official,2020,180,
33-026,33,2025,26,共通,生理学,専門基礎科目,生理学,呼吸生理,respiratory-physiology,動脈血の酸素飽和度（SpO2）の正常値と臨床的意義,,動脈血SpO2正常値≒97%。静脈血は約75%。SpO2 90%以下が呼吸不全・チアノーゼ出現の目安,,indexed_official,2020,180,
33-027,33,2025,27,共通,生理学,専門基礎科目,生理学,消化・吸収,metabolic-physiology,大腸の機能・腸内細菌叢・蠕動運動の特徴,,大腸＝水分・電解質吸収+腸内細菌叢による発酵。大蠕動は1日1〜3回（1時間数回は誤り）。消化酵素は分泌しない,,indexed_official,2020,180,
33-028,33,2025,28,共通,生理学,専門基礎科目,生理学,体液・電解質,renal-physiology,体液の恒常性と正常値（血液pH・尿量・浸透圧・体液分布）,,血液pH＝7.4±0.05。成人尿量1〜2L/日（400mLは乏尿閾値）。細胞外液浸透圧≒0.9%食塩水（3%は高張）。細胞内液は体液の約60%,,indexed_official,2020,180,
33-029,33,2025,29,共通,生理学,専門基礎科目,生理学,内分泌生理,endocrine-physiology,インスリンの産生部位・分泌調節・主な作用,,インスリン＝膵ランゲルハンス島β細胞産生。血糖上昇で分泌増加（抑制ではない）。細胞内グルコース取り込み促進・グリコーゲン合成促進,,indexed_official,2020,180,
33-030,33,2025,30,共通,生理学,専門基礎科目,生理学,細胞生理,histology,各種細胞の寿命比較（神経細胞が最長）,,神経細胞は基本的に再生しない→出生後から一生涯が最長寿命。赤血球約120日・血小板約10日・上皮細胞は数日〜数週間で更新,,indexed_official,2020,180,
33-031,33,2025,31,共通,生理学,専門基礎科目,生理学,神経生理,neurophysiology,大脳皮質の機能局在（運動野・感覚野・聴覚野・視覚野の位置）,,体性感覚野＝中心後回。運動野＝中心前回。視覚野＝後頭葉。聴覚野＝側頭葉上部（横側頭回）,,indexed_official,2020,180,
33-032,33,2025,32,共通,生理学,専門基礎科目,生理学,神経生理,neurophysiology,伸張反射の反射弓（受容器・求心路・遠心路・効果器）,,アキレス腱反射の受容器は筋紡錘（腱器官ではない）。求心路はIa群線維。遠心路はα運動ニューロン。効果器は錘外筋,,indexed_official,2020,180,
33-033,33,2025,33,共通,病理学概論,専門基礎科目,病理学概論,疾病の経過,general-pathology,疾病の経過における各期の症状（潜伏期〜回復期）,,不定愁訴が現れるのは前駆期。潜伏期は無症状。侵襲期は特異的主症状が出現。極期は症状が最も激しい時期,,indexed_official,2020,180,
33-034,33,2025,34,共通,病理学概論,専門基礎科目,病理学概論,代謝異常,general-pathology,疾患と代謝異常の対応（脂質・核酸・色素・鉄代謝）,,黄色腫→脂質代謝異常。痛風→核酸（プリン）代謝異常。黄疸→ビリルビン（色素）代謝異常。ヘモジデローシス→鉄（生体色素）代謝異常,,indexed_official,2020,180,
33-035,33,2025,35,共通,病理学概論,専門基礎科目,病理学概論,血液病理,hematology,播種性血管内凝固症候群（DIC）の病態と検査所見,,DICでは凝固因子・血小板が消費されるため減少（増加は誤り）。敗血症が主原因。細小血管内フィブリン血栓+出血症状が特徴,,indexed_official,2020,180,
33-036,33,2025,36,共通,病理学概論,専門基礎科目,病理学概論,循環障害,general-pathology,浮腫の発生機序（スターリングの原則）と4つの原因,,浮腫の原因：膠質浸透圧↓・リンパ還流↓・毛細血管内圧↑・血管透過性↑。膠質浸透圧上昇は浮腫を起こさない（逆方向）,,indexed_official,2020,180,
33-037,33,2025,37,共通,臨床医学各論,専門基礎科目,臨床医学各論,感染症,infectious-disease,HIV感染症の病態（標的細胞と免疫不全のメカニズム）,,HIV→CD4陽性ヘルパーT細胞を選択的に破壊→細胞性免疫不全→AIDS。CD4数200/μL以下でAIDS定義疾患が出現,,indexed_official,2020,180,
33-038,33,2025,38,共通,臨床医学各論,専門基礎科目,臨床医学各論,感染症・腫瘍,oncology,HPV感染と子宮頸癌の関係・ワクチン効果・自然排除,,HPVは子宮頸癌の主因（子宮内膜癌ではない）。男女ともに感染する。ワクチンで癌予防可能。多くは免疫機構で自然排除される,,indexed_official,2020,180,
33-039,33,2025,39,共通,臨床医学各論,専門基礎科目,臨床医学各論,精神・神経症状,neurology,睡眠障害の種類と特徴（入眠障害・過眠・SAS・RLS）,,SAS（睡眠時無呼吸）の危険因子は肥満・顎の形等。入眠障害≠中途覚醒。むずむず脚症候群は就眠時の異常感覚が特徴（早朝覚醒ではない）,,indexed_official,2020,180,
33-040,33,2025,40,共通,臨床医学各論,専門基礎科目,臨床医学各論,神経症状,neurology,失行の種類（構成失行・着衣失行・観念失行）と症状の違い,,構成失行＝図形・積み木の模倣・構成ができない。着衣失行＝服が着られない。言語復唱不可は失語（失行ではない）,,indexed_official,2020,180,
33-041,33,2025,41,共通,臨床医学総論,専門基礎科目,臨床医学総論,診察・計測,clinical-general,四肢周径測定の方法（上腕・前腕・大腿・下腿の測定部位）,,前腕周径＝最大膨隆部で計測。上腕は伸展位の最大膨隆部。下腿は最大膨隆部（腓骨頭の高さではない）,,indexed_official,2020,180,
33-042,33,2025,42,共通,臨床医学総論,専門基礎科目,臨床医学総論,バイタルサイン,clinical-general,脈拍変化の原因疾患（頻脈・徐脈の鑑別）,,脳圧亢進→徐脈（クッシング反応）。甲状腺機能低下→徐脈。甲状腺機能亢進・発熱・貧血→頻脈。パーキンソン病は脈拍変化しない,,indexed_official,2020,180,
33-043,33,2025,43,共通,臨床医学各論,専門基礎科目,臨床医学各論,血液疾患,hematology,易感染性をきたす疾患と機序（好中球減少・免疫不全）,,急性骨髄性白血病→好中球減少→易感染性が最も直結。ITP・巨赤芽球性貧血は出血傾向・貧血が主。鉄欠乏性貧血は易感染性と直結しない,,indexed_official,2020,180,
33-044,33,2025,44,共通,臨床医学各論,専門基礎科目,臨床医学各論,消化器疾患,gastroenterology,便秘の原因（薬剤性・機能性・腸管運動抑制）,,オピオイド→μ受容体を介して腸蠕動を抑制→薬剤性便秘の代表的原因。ノロウイルス・乳糖不耐症・胃切除は下痢の原因,,indexed_official,2020,180,
33-045,33,2025,45,共通,臨床医学総論,専門基礎科目,臨床医学総論,症候学,pulmonology,チアノーゼの発生機序と原因とならない疾患（還元Hb閾値）,,チアノーゼ＝還元Hb 5g/dL以上。貧血はHb総量少なく閾値に達しにくい→チアノーゼになりにくい。左心不全・チアノーゼ性心疾患・COPDは原因になる,,indexed_official,2020,180,
33-046,33,2025,46,共通,臨床医学総論,専門基礎科目,臨床医学総論,呼吸器診察,pulmonology,肺の身体所見（声音振盪）の変化と疾患の対応,,声音振盪増強＝肺の実質化（肺炎・無気肺）。減弱＝気胸・胸水・肺気腫。増強と減弱の方向を肺炎を軸に覚える,,indexed_official,2020,180,
33-047,33,2025,47,共通,臨床医学総論,専門基礎科目,臨床医学総論,神経診察,neurology,脳神経の番号・名称・支配筋・機能の対応,,副神経（第11脳神経）＝僧帽筋+胸鎖乳突筋を支配。三叉神経＝咀嚼筋。顔面神経＝表情筋。迷走神経≠僧帽筋,,indexed_official,2020,180,
33-048,33,2025,48,共通,臨床医学総論,専門基礎科目,臨床医学総論,緩和ケア,medical-ethics,ターミナルケア・緩和ケアの目標と倫理的方針,,ターミナルケアの目標＝苦痛緩和とQOL維持（根治・延命が目標ではない）。治療方針は医師+患者本人の意思決定が中心（家族のみでない）,,indexed_official,2020,180,
33-049,33,2025,49,共通,臨床医学各論,専門基礎科目,臨床医学各論,感染症・食中毒,infectious-disease-control,食中毒の原因菌と原因食品の正しい対応,,カンピロバクター＝鶏肉（加熱不十分）。腸炎ビブリオ＝魚介類。サルモネラ＝鶏卵・肉類。腸管出血性大腸菌＝牛肉（ユッケ等）,,indexed_official,2020,180,
33-050,33,2025,50,共通,臨床医学各論,専門基礎科目,臨床医学各論,眼科疾患,clinical-general,緑内障の病態・症状・疫学（日本の失明原因）,,緑内障は日本の中途失明原因第1位。視神経障害が本質（硝子体でない）。初期は周辺視野から障害（中心は後期）。眼圧上昇が主因,,indexed_official,2020,180,
33-051,33,2025,51,共通,臨床医学各論,専門基礎科目,臨床医学各論,精神疾患,neurology,パニック発作・パニック障害の特徴と治療,,パニック発作は予期せず突然発症し数分〜30分程度で消退（数時間は誤り）。認知行動療法とSSRIが有効。過換気への酸素投与は適応外,,indexed_official,2020,180,
33-052,33,2025,52,共通,臨床医学各論,専門基礎科目,臨床医学各論,皮膚疾患,dermatology,アトピー性皮膚炎の皮疹分布・アレルギー型・治療方針,,小児アトピー＝四肢大関節屈側（肘窩・膝窩）に多い。Ⅰ型（IgE介在）アレルギー。ステロイド外用が第一選択（抗ヒスタミン薬内服は補助）,,indexed_official,2020,180,
33-053,33,2025,53,共通,臨床医学各論,専門基礎科目,臨床医学各論,感染症,infectious-disease,結核と非結核性抗酸菌症の違い（感染経路・難治性）,,肺結核の感染経路は飛沫核感染（空気感染）。非結核性抗酸菌（NTM）は人→人感染しない。NTM症は難治性（多剤長期投与が必要）,,indexed_official,2020,180,
33-054,33,2025,54,共通,臨床医学各論,専門基礎科目,臨床医学各論,呼吸器疾患,pulmonology,COPDの病因・特徴的症状・合併症・治療原則,,主原因は喫煙（受動喫煙も関与）。労作時呼吸困難が特徴（安静時ではない）。肺癌合併リスク高い。禁煙で進行抑制（肺機能完全回復はしない）,,indexed_official,2020,180,
33-055,33,2025,55,共通,臨床医学各論,専門基礎科目,臨床医学各論,呼吸器疾患,pulmonology,気管支喘息の病態・換気障害の型・発作の特徴,,喘息はⅠ型アレルギー（IgE介在）。閉塞性換気障害（拘束性ではない）。発作は夜間・明け方に多い（副交感神経優位による気管支収縮）,,indexed_official,2020,180,
33-056,33,2025,56,共通,臨床医学各論,専門基礎科目,臨床医学各論,アレルギー疾患,dermatology,アナフィラキシーの原因疾患の頻度と緊急対応,,アナフィラキシー最多原因＝食物アレルギー（小児）・薬物（成人）。Ⅰ型アレルギーの最重症型。アドレナリン（エピネフリン）筋注が第一選択,,indexed_official,2020,180,
33-057,33,2025,57,共通,臨床医学各論,専門基礎科目,臨床医学各論,消化器疾患,gastroenterology,胃食道逆流症（GERD）の病態・バレット食道・増悪因子,,GERD→下部食道括約筋弛緩→胃酸逆流。食道下部扁平上皮が円柱上皮化（バレット食道）→腺癌リスク。肥満・前屈が悪化因子（体重増加で悪化）,,indexed_official,2020,180,
33-058,33,2025,58,共通,臨床医学各論,専門基礎科目,臨床医学各論,神経・認知症,neurology,アルツハイマー病の初期症状と認知症の鑑別（各型の特徴）,,アルツハイマー初期＝近時記憶障害。幻視が初期→レビー小体型。人格変化が初期→前頭側頭型（ピック）。段階的悪化→脳血管性,,indexed_official,2020,180,
33-059,33,2025,59,共通,臨床医学各論,専門基礎科目,臨床医学各論,消化器疾患,gastroenterology,クローン病と潰瘍性大腸炎の鑑別と共通点,,クローン病は全消化管（大腸に限局しない）。潰瘍性大腸炎は連続性病変（非連続はクローン）。両疾患とも欧米化で増加。赤沈は病勢を反映する,,indexed_official,2020,180,
33-060,33,2025,60,共通,臨床医学各論,専門基礎科目,臨床医学各論,消化器疾患,gastroenterology,膵癌の腫瘍マーカー・診断方法・予後の特徴,,CA19-9は膵癌の代表的腫瘍マーカー（特異度は高い設問だが確定診断には不十分）。早期発見困難で予後不良。超音波・CT・ERCPで診断,,indexed_official,2020,180,
33-061,33,2025,61,共通,臨床医学各論,専門基礎科目,臨床医学各論,内分泌疾患,endocrinology,内分泌疾患と特徴的症状の正しい対応（アジソン・バセドウ・クッシング）,,アジソン病→色素沈着（副腎皮質機能低下）。バセドウ病→眼球突出・頻脈。クッシング病→満月様顔貌・中心性肥満。原発性アルドステロン症→低K血症・高血圧,,indexed_official,2020,180,
33-062,33,2025,62,共通,臨床医学各論,専門基礎科目,臨床医学各論,骨格系疾患,orthopedics,体前屈時の肋骨隆起（rib hump）と脊柱変形の鑑別,,体前屈時の肋骨隆起（rib hump）は側弯症の特徴的診察所見。スコリオメーターで角度を計測。成長期女児に多い。肺腫瘍・肋骨骨折は肋骨隆起を起こさない,,indexed_official,2020,180,
33-063,33,2025,63,共通,臨床医学各論,専門基礎科目,臨床医学各論,股関節疾患,orthopedics,発育性股関節形成不全（DDH）の疫学・危険因子・治療,,DDHは女児に多い（男児に多いは誤り）。逆子・家族歴・第一子が危険因子。装具療法（リーメンビューゲル）が主体。家族内発生あり,,indexed_official,2020,180,
33-064,33,2025,64,共通,臨床医学各論,専門基礎科目,臨床医学各論,変性疾患,orthopedics,変形性関節症のX線4徴（軟骨下骨硬化・骨棘・骨囊胞・裂隙変化）,,変形性関節症X線所見：関節裂隙狭小化（拡大は誤り）・荷重部軟骨下骨硬化・骨棘形成・骨囊胞形成の4徴。裂隙は狭小化する,,indexed_official,2020,180,
33-065,33,2025,65,共通,臨床医学各論,専門基礎科目,臨床医学各論,泌尿器疾患,urology,前立腺肥大症の症状（初期・進行期）と鑑別,,前立腺肥大症の初期症状は夜間頻尿（刺激症状）。進行→尿勢低下・残尿感・尿閉（閉塞症状）。血尿や排尿時痛は前立腺肥大の主症状でない,,indexed_official,2020,180,
33-066,33,2025,66,共通,臨床医学各論,専門基礎科目,臨床医学各論,血液疾患,hematology,鉄欠乏性貧血の全身症状（爪・口腔・舌・異食症）,,鉄欠乏性貧血：スプーン爪（匙状爪）・口角炎・舌炎・プランマービンソン症候群・異食症。知覚鈍麻や白髪は鉄欠乏でなく他疾患の症状,,indexed_official,2020,180,
33-067,33,2025,67,共通,臨床医学各論,専門基礎科目,臨床医学各論,血液疾患,hematology,特発性血小板減少性紫斑病（ITP）の病態・特徴・治療,,ITPは血小板に対するIgG自己抗体が原因（血管への自己抗体ではない）。女性に多い。H.pylori除菌療法・ステロイド投与が有効。血腫は筋肉内でなく皮下や粘膜,,indexed_official,2020,180,
33-068,33,2025,68,共通,臨床医学各論,専門基礎科目,臨床医学各論,神経・認知症,neurology,各認知症の初期症状と鑑別（前頭側頭型・レビー小体型・アルツハイマー・脳血管性）,,前頭側頭型（ピック病）→病初期から人格障害・脱抑制・常同行動。アルツハイマー→近時記憶障害。レビー小体型→初期から幻視。脳血管性→段階的悪化・まだら認知症,,indexed_official,2020,180,
