id,examRound,year,questionNumber,session,subject,officialLarge,officialMedium,officialSmall,normalizedTheme,subTheme,importance,studyPoint,sourceUrl,sourceReliability,blueprintVersion,questionCountMode,memo
33-132,33,2025,132,共通,はり理論,専門科目,はり理論,神経疾患,neurology,パーキンソン病患者の書字所見（小字症）,,パーキンソン病の書字：小字症（文字が徐々に小さくなる・筆圧低下）。書痙は局所ジストニア。吃書はてんかん・失語。自発書字障害は遂行機能障害,,indexed_official,2020,180,
33-133,33,2025,133,共通,はり理論,専門科目,はり理論,神経疾患,neurology,症例：耳痛→難聴・顔面麻痺・外耳孔水疱=ラムゼイハント症候群,,ラムゼイハント症候群：VZVによる膝神経節侵犯→耳痛・外耳孔水疱・顔面神経麻痺・聴覚障害の三徴。ベル麻痺とは外耳孔水疱の有無で鑑別,,indexed_official,2020,180,
33-134,33,2025,134,共通,はり理論,専門科目,はり理論,末梢神経絞扼,orthopedics,肘部管症候群の原因筋触察部位（内側上顆下縁→豆状骨）,,尺骨神経は内側上顆後方を通過し肘部管を形成。尺側手根屈筋（上腕骨頭：内側上顆下縁→豆状骨）が原因筋。触察はこの走行上で行う,,indexed_official,2020,180,
33-135,33,2025,135,共通,はり理論,専門科目,はり理論,血管疾患,cardiology,症例：下肢冷え・間欠性跛行・休憩で改善・血圧高・喫煙歴=閉塞性動脈硬化症,,閉塞性動脈硬化症（ASO）：動脈硬化による下肢虚血。間欠性跛行（歩行→痛み・休憩で消失）。ケンプテスト陰性→腰部脊柱管狭窄症を除外,,indexed_official,2020,180,
33-136,33,2025,136,共通,はり理論,専門科目,はり理論,末梢神経痛,acupuncture-technique,症例：母指〜中指しびれ・手振ると楽=手根管症候群の局所治療部位（大陵と労宮の間）,,手根管症候群：正中神経絞扼（手根管）→母指〜環指橈側しびれ。局所治療穴は手根管部（大陵〜労宮の間）への刺鍼が適切,,indexed_official,2020,180,
33-137,33,2025,137,共通,はり理論,専門科目,はり理論,脊椎疾患,orthopedics,症例：歩行時下肢後面痛・手押し車で改善・冷感なし=腰部脊柱管狭窄症の異常検査（アキレス腱反射）,,腰部脊柱管狭窄症：前屈みで症状改善（手押し車使用）・間欠性跛行。アキレス腱反射の減弱がみられる。バビンスキー反射・フライバーグは別疾患,,indexed_official,2020,180,
33-138,33,2025,138,共通,はり理論,専門科目,はり理論,精神疾患,neurology,うつ病でみられる妄想（罪責妄想）,,うつ病の三大妄想：罪業妄想・貧困妄想・心気妄想。関係妄想・物盗られ妄想は統合失調症・認知症。血統妄想は誇大妄想（躁病・統合失調症）,,indexed_official,2020,180,
33-139,33,2025,139,共通,はり理論,専門科目,はり理論,血液疾患,hematology,鉄欠乏性貧血患者へのヘム鉄豊富食材（豚レバー）,,ヘム鉄（動物性・吸収率20〜30%）は非ヘム鉄（植物性・卵・豆類・吸収率5%）より高吸収。豚レバーはヘム鉄が豊富。ホウレンソウ・卵・大豆は非ヘム鉄,,indexed_official,2020,180,
33-140,33,2025,140,共通,はり理論,専門科目,はり理論,スポーツ障害,orthopedics,投球動作で肘後方への伸展ストレスが最大となる時期（フォロースルー期）,,投球動作フェーズ：早期コッキング（外転挙上）→後期コッキング（肘外側圧迫→肘内側牽引ストレス）→加速期→フォロースルー期（肘後方伸展ストレス最大）,,indexed_official,2020,180,
33-141,33,2025,141,共通,はり理論,専門科目,はり理論,スポーツ障害,acupuncture-technique,テニス肘（中指伸展テスト陽性）の罹患筋への局所治療穴（手三里）,,テニス肘（上腕骨外側上顆炎）：短橈側手根伸筋が主な罹患筋。手三里（LI10）が短橈側手根伸筋への局所治療穴として最適。曲沢・小海は肘内側,,indexed_official,2020,180,
33-142,33,2025,142,共通,はり理論,専門科目,はり理論,整形外科疾患,orthopedics,下腿コンパートメント症候群と罹患筋の対応（浅後方コンパートメント=ヒラメ筋）,,下腿4コンパートメント：前方（前脛骨筋・長指伸筋）・外側（腓骨筋）・浅後方（腓腹筋・ヒラメ筋）・深後方（後脛骨筋・長指屈筋）,,indexed_official,2020,180,
33-143,33,2025,143,共通,はり理論,専門科目,はり理論,脈診・季節,tcm-clinical,季節の平脈（軽く軟らかで力ない浮いた脈=春の正常脈）,,春の平脈：弦だが軟らかく浮き気味（軟弦・浮弦）。夏は洪大・秋は毛浮・冬は石沈。問題の脈は浮・軟らかを強調し春の正常と判断,,indexed_official,2020,180,
33-144,33,2025,144,共通,はり理論,専門科目,はり理論,刺法理論,acupuncture-technique,肌肉のしびれ・だるさに対する五刺（分刺）の刺法,,五刺：半刺（皮）・豹文刺（絡脈）・関刺（筋）・合谷刺（筋肉）・輸刺（骨）。分刺（別称：合谷刺）＝鶏爪刺でニワトリの足のように分肉の間に刺す,,indexed_official,2020,180,
33-145,33,2025,145,共通,はり理論,専門科目,はり理論,弁証論治,tcm-clinical,症例：急速円形脱毛・頭皮赤み・口渇・便秘・小便黄・舌紅苔黄脈数=血熱,,血熱の症状：急速な脱毛・頭皮の赤み・熱証（口渇・便秘・小便黄）・舌紅苔黄・脈数。血瘀は刺痛・暗色・夜間増悪。陰虚は虚熱証,,indexed_official,2020,180,
33-146,33,2025,146,共通,はり理論,専門科目,はり理論,循経取穴,acupuncture-technique,耳鳴り・難聴への循経取穴（中渚=手少陽三焦経）,,耳鳴り・難聴に対する循経取穴：手少陽三焦経（中渚・外関）が耳に循行。太淵（肺経）・三間（大腸経）・神門（心経）は耳に循行しない,,indexed_official,2020,180,
33-147,33,2025,147,共通,はり理論,専門科目,はり理論,弁証論治,tcm-clinical,症例：肺気虚（無力な咳・声なし・息切れ・倦怠感・舌淡苔薄白・脈弱）の痰の性状（稀薄透明）,,肺気虚の痰：稀薄・透明。肺熱は黄色粘稠。痰湿（肺寒）は白色大量。肺陰虚は血痰（または少量粘稠）,,indexed_official,2020,180,
33-148,33,2025,148,共通,はり理論,専門科目,はり理論,難経六十九難,acupuncture-technique,症例：腎虚尿漏れ→難経六十九難補母法の取穴（復溜）,,腎(水)の虚→「虚者補其母」→母臓＝肺(金)→肺経の金穴or腎経自身の補法。腎経の経穴（金穴）＝復溜（KI7）が腎虚の直接補法穴として適切,,indexed_official,2020,180,
33-149,33,2025,149,共通,はり理論,専門科目,はり理論,灸法・適応,acupuncture-technique,骨盤位矯正に効果的とされる膀胱経の要穴（至陰=井穴）,,至陰（BL67）：膀胱経の井穴（金穴）。骨盤位（逆子）矯正への灸療法として至陰への灸が有効とされる。逆子灸の代表穴,,indexed_official,2020,180,
33-150,33,2025,150,共通,東洋医学臨床論,専門科目,東洋医学臨床論,経脈病証,meridians-acupoints,症例「空腹感あるが食欲なし・呼吸苦しく咳込む・寝ることを好む」=足少陰腎経病証,,足少陰腎経病証：空腹感あるが食欲なし（腎経は胃を絡む）・呼吸困難・咳・嗜臥。足太陰脾経病証は腹満・下痢・食欲不振が主,,indexed_official,2020,180,
33-151,33,2025,151,共通,東洋医学臨床論,専門科目,東洋医学臨床論,弁証論治,tcm-clinical,症例：夫の死→うつ→気力減退・食欲なし・動悸・不眠・健忘・舌淡・脈細弱=心脾両虚,,心脾両虚：心気虚（動悸・不眠・健忘）＋脾気虚（食欲不振・倦怠感）の合証。悲しみ→気力減退→心脾同時虚損,,indexed_official,2020,180,
33-152,33,2025,152,共通,東洋医学臨床論,専門科目,東洋医学臨床論,弁証論治,tcm-clinical,うつ病回復期（食欲改善後）に最も注意すべき症状（自殺念慮）,,うつ病の回復初期：意欲が回復すると行動化のリスク（自殺念慮・企図）が最も高くなる。幻聴・観念奔逸は統合失調症・躁病の症状,,indexed_official,2020,180,
33-153,33,2025,153,共通,はり理論,専門科目,はり理論,末梢神経障害,neurology,症例：橈骨遠位端骨折後・示中指しびれ・母指障害→最も認められる徴候（パーフェクトOの不整）,,橈骨遠位端骨折（コーレス骨折）→正中神経麻痺→母指球筋萎縮・示中指しびれ。パーフェクトO（OK sign）の不整が正中神経麻痺の特徴的所見,,indexed_official,2020,180,
33-154,33,2025,154,共通,はり理論,専門科目,はり理論,整形外科疾患,orthopedics,橈骨遠位端骨折後の正中神経麻痺（骨折した骨は橈骨）,,コーレス骨折：橈骨遠位端の骨折→手関節フォーク様変形→正中神経を圧迫→母指〜中指しびれ・母指対立障害,,indexed_official,2020,180,
33-155,33,2025,155,共通,はり理論,専門科目,はり理論,神経疾患,neurology,症例：インスタント麺偏食・倦怠感・下肢しびれ・膝蓋腱反射減弱=ビタミンB1欠乏（脚気）,,ビタミンB1（チアミン）欠乏→脚気：末梢神経障害（下肢しびれ・腱反射減弱）・心不全。精白食品・インスタント食品偏食が誘因,,indexed_official,2020,180,
33-156,33,2025,156,共通,はり理論,専門科目,はり理論,特定穴・要穴,meridians-acupoints,脚気八処（8つの補穴の組合せ）に含まれる経穴（上巨虚）,,脚気八処：脚気・下肢麻痺の治療に用いる8穴の組合せ。上巨虚（ST37）が含まれる。膝陽関・内膝眼は含まれない,,indexed_official,2020,180,
33-157,33,2025,157,共通,東洋医学臨床論,専門科目,東洋医学臨床論,弁証論治,gastroenterology,症例：ストレス→腹痛・下痢・休日症状なし・舌淡紅苔少・脈弦=過敏性腸症候群（肝脾不和）,,過敏性腸症候群（IBS）：器質的異常なし・ストレス誘因・休日改善。東洋医学的には肝脾不和に対応（脈弦・ストレス誘因）,,indexed_official,2020,180,
33-158,33,2025,158,共通,東洋医学臨床論,専門科目,東洋医学臨床論,弁証論治,tcm-clinical,過敏性腸症候群（肝脾不和）の治療方針（肝と脾の調和を図る）,,IBS（肝脾不和）の治療方針：疏肝健脾（肝と脾の調和）。心腎交通・肺腎陰補・心肝火下降は本証と一致しない,,indexed_official,2020,180,
33-159,33,2025,159,共通,はり理論,専門科目,はり理論,顔面神経麻痺,acupuncture-technique,四総穴を踏まえた顔面神経麻痺の治療穴（合谷）,,四総穴：合谷（颜面・口腔）→顔面神経麻痺に合谷が適切。列欠（頭項）・委中（腰背）・足三里（腹部）とそれぞれの主治を整理する,,indexed_official,2020,180,
33-160,33,2025,160,共通,はり理論,専門科目,はり理論,顔面神経麻痺,neurology,顔面神経麻痺の後遺障害として最も可能性が高いのはどれか（ワニの涙）,,ワニの涙（鱷魚の涙）：顔面神経麻痺回復期の迷入再生→食事時に涙が出る。眼瞼下垂は動眼神経。共同偏視・眼球陥凹は顔面神経と無関係,,indexed_official,2020,180,
33-161,33,2025,161,共通,はり理論,専門科目,はり理論,古代九鍼,acupuncture-technique,古代九鍼で皮膚を切開するのはどれか（鈹鍼）,,九鍼の種類と用途：鈹鍼（剣形→皮膚切開・排膿）。鑱鍼→皮膚浅刺。員利鍼→急性痹。大鍼（梃鍼）→関節水腫。円鍼→皮膚摩擦,,indexed_official,2020,180,はり師専用
33-162,33,2025,162,共通,はり理論,専門科目,はり理論,刺鍼手技,acupuncture-technique,基本17手技で刺入深度が最も深くなる手技（鍼尖転移法）,,基本17手技：鍼尖転移法は最も深い刺入。屋漏術は弾入動作（浅め）。管散術は皮膚への散鍼。細指術は中等度の深さ,,indexed_official,2020,180,はり師専用
33-163,33,2025,163,共通,はり理論,専門科目,はり理論,特殊鍼法,acupuncture-technique,特殊鍼法で横刺するのはどれか（皮内鍼）,,皮内鍼：皮膚内に水平方向（横刺）で刺入し固定。灸頭鍼は直刺。小児鍼は接触鍼（刺入なし）。円皮鍼は輪状に短く刺す（垂直）,,indexed_official,2020,180,はり師専用
33-164,33,2025,164,共通,はり理論,専門科目,はり理論,鍼の禁忌,acupuncture-technique,鍼療法の禁忌（手術を必要とする状態）,,鍼の禁忌：手術を必要とする急性疾患（急性虫垂炎・イレウス等）。つわり・筋疲労・脳血管障害回復期はいずれも鍼の適応となりうる,,indexed_official,2020,180,はり師専用
33-165,33,2025,165,共通,はり理論,専門科目,はり理論,刺鍼リスク,acupuncture-technique,刺鍼により心タンポナーデの危険性がある経穴（膻中）,,膻中（CV17）：胸骨体上の経穴。深刺→心膜穿刺→心タンポナーデのリスク。中府・期門は気胸リスク。巨闕は深刺で胃・肝臓損傷のリスク,,indexed_official,2020,180,はり師専用
33-166,33,2025,166,共通,はり理論,専門科目,はり理論,有害事象,acupuncture-technique,鍼施術後の失神の原因として最も多いのはどれか（脳貧血）,,鍼施術後の失神最多原因は脳貧血（迷走神経反射・起立性低血圧）。気胸は呼吸困難。低血糖は長時間絶食患者。遺感覚は失神と無関係,,indexed_official,2020,180,はり師専用
33-167,33,2025,167,共通,はり理論,専門科目,はり理論,鍼の作用機序,acupuncture-technique,副腎髄質でアセチルコリンが結合する受容体（ニコチン受容体）,,副腎髄質クロム親和性細胞は交感神経節後細胞と相同。交感神経節前線維→アセチルコリン→ニコチン受容体に結合→カテコールアミン（アドレナリン）分泌,,indexed_official,2020,180,はり師専用
33-168,33,2025,168,共通,はり理論,専門科目,はり理論,下行性疼痛抑制系,acupuncture-technique,青斑核から放出され脊髄後角で侵害受容情報を阻害する物質（ノルアドレナリン）,,下行性疼痛抑制系：PAG→縫線核（セロトニン）→脊髄後角抑制。青斑核（LC）→ノルアドレナリン放出→脊髄後角α2受容体を介して侵害受容情報を抑制,,indexed_official,2020,180,はり師専用
33-169,33,2025,169,共通,はり理論,専門科目,はり理論,下行性疼痛抑制系,acupuncture-technique,下行性抑制系について最も適切なのはどれか（脊髄前側索を下行する）,,下行性疼痛抑制系：PAGのGABA作動性ニューロン抑制が除かれることで賦活（GABAの興奮では賦活されない）。脊髄前側索を下行。ヒスタミンは関与しない,,indexed_official,2020,180,はり師専用
33-170,33,2025,170,共通,はり理論,専門科目,はり理論,鍼の作用機序,acupuncture-technique,刺鍼により痛みの悪循環を最も改善させる機序（NOによる血管拡張）,,痛みの悪循環：侵害受容→筋緊張→虚血→発痛物質産生。NOによる血管拡張→血流改善→発痛物質の洗い流し→悪循環を断ち切る,,indexed_official,2020,180,はり師専用
33-171,33,2025,171,共通,きゅう理論,専門科目,きゅう理論,艾・灸の基礎,acupuncture-technique,透熱灸に用いる艾について正しいのはどれか（精油成分が多い）,,良質の艾は精油成分（シネオール等）が多い。夾雑物少・灰分少・燃焼均一・灰白色が特徴。黒褐色・灰分多は劣質,,indexed_official,2020,180,きゅう師専用
33-172,33,2025,172,共通,きゅう理論,専門科目,きゅう理論,灸術の種類,acupuncture-technique,艾を使用しない灸術（紅灸）,,紅灸は食塩・硫黄等を用いる（艾を使用しない）。ビワの葉灸・ショウガ灸・押し灸はいずれも艾炷・艾条を使用する,,indexed_official,2020,180,きゅう師専用
33-173,33,2025,173,共通,きゅう理論,専門科目,きゅう理論,施灸の注意,acupuncture-technique,透熱灸を行う上で最も注意が必要な疾患（糖尿病）,,糖尿病患者：末梢神経障害による知覚低下→熱傷感知困難＋創傷治癒遅延のリスク。施灸禁忌に準じた最大注意を要する疾患,,indexed_official,2020,180,きゅう師専用
33-174,33,2025,174,共通,きゅう理論,専門科目,きゅう理論,施灸の禁忌,acupuncture-technique,透熱灸を最も避けるべき経穴（陽白）,,陽白（GB14）は顔面・眼周囲の経穴。透熱灸は顔面に瘢痕が残るため施灸禁忌。陽谷・陽池・陽交は四肢の経穴で禁忌ではない,,indexed_official,2020,180,きゅう師専用
33-175,33,2025,175,共通,きゅう理論,専門科目,きゅう理論,施灸の消毒,acupuncture-technique,有痕灸施術部の消毒で最も適切（施灸前後に行う）,,有痕灸の消毒：施灸前後の両方に実施（感染予防）。往復拭きは汚染拡散のリスク。清拭圧は弱め。次亜塩素酸ナトリウムは皮膚消毒に不適切,,indexed_official,2020,180,きゅう師専用
33-176,33,2025,176,共通,きゅう理論,専門科目,きゅう理論,灸の作用機序,acupuncture-technique,熱刺激情報の伝導路（外側脊髄視床路）,,熱・痛覚の伝導路：外側脊髄視床路（新脊髄視床路）→視床→一次感覚野。腹側脊髄視床路は触覚・圧覚。外側皮質脊髄路は運動路,,indexed_official,2020,180,きゅう師専用
33-177,33,2025,177,共通,きゅう理論,専門科目,きゅう理論,施灸局所反応,acupuncture-technique,施灸局所の軸索反射で最も適切なのはどれか（血漿が漏出する）,,軸索反射：侵害受容器興奮→逆行性伝導→神経ペプチド（サブスタンスP・CGRP）遊離→血管拡張・血漿漏出（浮腫）。ノルアドレナリン・Aβ線維は関与しない,,indexed_official,2020,180,きゅう師専用
33-178,33,2025,178,共通,きゅう理論,専門科目,きゅう理論,施灸局所反応,acupuncture-technique,透熱灸による炎症でアナフィラトキシンとして作用するもの（補体）,,補体（C3a・C5a）＝アナフィラトキシン→肥満細胞からヒスタミン遊離→血管拡張・透過性亢進。IgEはⅠ型アレルギー。コルチゾールは抗炎症。ヒスタミン自体はアナフィラトキシンでない,,indexed_official,2020,180,きゅう師専用
33-179,33,2025,179,共通,きゅう理論,専門科目,きゅう理論,施灸の作用機序,acupuncture-technique,透熱灸による反応で最も早期に起こるのはどれか（ポリモーダル受容器の興奮）,,透熱灸の反応時系列：ポリモーダル受容器の興奮（最早期）→温熱感覚の認知→局所血管拡張→白血球浸潤,,indexed_official,2020,180,きゅう師専用
33-180,33,2025,180,共通,きゅう理論,専門科目,きゅう理論,施灸局所反応,acupuncture-technique,透熱灸による末梢性痛覚過敏に関与する物質（セロトニン）,,組織損傷部から放出される末梢性発痛・痛覚過敏物質：セロトニン・ブラジキニン・プロスタグランジン・ヒスタミン。NO・アドレナリン・アセチルコリンは痛覚過敏への直接関与は低い,,indexed_official,2020,180,きゅう師専用
